Ни один тренер не воспитал столько классных альпинистов и скалолазов, сколько выдрессировала строгая вахтерша тетя Груня в женском общежитии.Весь мир подъезд, а люди в нем насрали.Я не то, чтобы прям бедный. Но у меня осенняя и весенняя — это одна и та же курткаМужчины делятся на достойных и недостойных. Женщины — на молодых и старых.- Представляю, как мучались со своими женами наши дикие предки. Мозгов ноль и лохматая, как обезьяна.- А сейчас что изменилось?- Ну, сейчас лохматость значительно понизилась.Заказчик:- Слушай, скажу тебе честно: денег я тебе не заплачу, да там и не за что, на самом деле. Ты много запросил, а у меня бизнес затратный, я даже и минимальную сумму заплатить не готов. Но ты же уже выполнил работу, отдай мне её за так. Я поставлю этот код, а тебе приятно будет. А если денег заработаю, то позже тебе настоящих заказов подкину. Я человек слова, деньгами не обижу! Вот не дашь ты мне этот код и кому от этого лучше будет? Да и вообще - чо твоему труду пропадать!?Фрилансер:- Всё готово. После получения средств поставил бы код на ваш сайт. Но в этом случае я делаю так- заливаю сайт на мой хост, вешаю твою оферту и делаю получателем свой ИП. Деньги мне заплатит покупатель. И я сразу перевожу код на твой домен.Гостям всегда рады: одним - когда они приходят, другим - когда они уходят.Невроз сделал из обезьяны человека.Те, кто пользуются жиросжигающими средствами, должны знать, что лучше всего сжечь жир можно поработав кочегаром в угольной котельной.- Рабинович. Ви, таки, как говорят, прекратили все дела с Кацманом. Шо так?- Послушайте. Видавая замуж свою Софочку, Кацман вивалил на свадьбу мильён денег. Ви читали за статистику разводов? Я не хочу иметь дел с поцем, которий вкладивает деньги с риском в 80%!!!Высшая степень нарциссизма у женщины - это открыть салон красоты имени себя.На свадьбе гость интересуется:- Скажите, а кто та дама в белом?- Невеста.- Белый цвет ее ужасно полнит.- Еще бы, она на шестом месяце беременности.Когда я учился в школе, у меня по геометрии была круглая, квадратная и треугольная пятёрка!Фрейлины беседуют между собой.- Чего хорошего в поручике Ржевском?- Давайте не будем обсуждать столь неприличные предметы.Дама своей подруге:- А Васька из соседней квартиры оказывается мазохист.Подруга:- Как ты это определила?Дама:-Знает мой характер, и совершенно трезвый предложил нам пожениться.- Я выходила на работу через 2 недели после собеса по своему желанию. Уходила с другой работы и неделю отбухала.- Может быть отдыхала?- Нет.Сын спрашивает у родителей:- Почему на свете столько гендеров, а врачей для них всего два - гинеколог и уролог? - Сынок, остальных лечит психиатр!